{"schema":"hexalith.check-suite.v1","suiteId":"fixture-reference","version":"1.0.0","module":"fixture","owner":"@jpiquot","source":"module.json","runtime":"python3","entrypoint":"runner.py","payload":["runner.py"],"checks":[{"id":"fixture.read","surface":"fixture-api","kind":"smoke","assertion":"positive","environments":["staging","production"],"timeoutSeconds":30,"cadenceSeconds":300,"effect":"read","tenancy":"existing-synthetic"}]}
